<?xml version="1.0" encoding="UTF-8" standalone="no"?>
<!DOCTYPE Notes SYSTEM "Notes.dtd">

<Notes>
    <Note>
        <CodeApogee>2000073</CodeApogee>
        <ModuleCode>GINF32</ModuleCode>
        <SousModule>JAVA</SousModule>
        <Moyenne>15</Moyenne>
    </Note>
    <Note>
        <CodeApogee>2000073</CodeApogee>
        <ModuleCode>GINF32</ModuleCode>
        <SousModule>C++</SousModule>
        <Moyenne>19</Moyenne>
    </Note>
    <Note>
        <CodeApogee>2000077</CodeApogee>
        <ModuleCode>GINF32</ModuleCode>
        <SousModule>JAVA</SousModule>
        <Moyenne>20</Moyenne>
    </Note>
    <Note>
        <CodeApogee>2000077</CodeApogee>
        <ModuleCode>GINF32</ModuleCode>
        <SousModule>C++</SousModule>
        <Moyenne>20</Moyenne>
    </Note>
    <Note>
        <CodeApogee>2000073</CodeApogee>
        <ModuleCode>GINF33</ModuleCode>
        <SousModule>Python</SousModule>
        <Moyenne>13</Moyenne>
    </Note>
</Notes>
